<?xml version="1.0" encoding="UTF-8"?>
<tns:ScenarioFlowDiagramReferencedContent
	xmlns:tns="http://www.sap.com/ScenarioFlowDiagramReferencedContent"
	xmlns:xsi="http://www.w3.org/2001/XMLSchema-instance"
	xsi:schemaLocation="http://www.sap.com/ScenarioFlowDiagramReferencedContent ../ScenarioFlowDiagramReferencedContent.xsd ">
	<tns:RealizedBusinessScenario ID="300">
		<tns:Title>Plan-Driven Procurement in ERP</tns:Title>
		<tns:RealizedBusinessProcess ID="301">
			<tns:Title>Purchase Request Processing</tns:Title>
			<tns:RealizedBusinessProcessVariant
				ID="302">
				<tns:Title>variant 1"</tns:Title>
			</tns:RealizedBusinessProcessVariant>
			<tns:ProcessComponent ID="303">
				<tns:Title>Process Component 1</tns:Title>
				<tns:DeploymentUnit ID="304">
					<tns:Title>ERP Americas</tns:Title>
				</tns:DeploymentUnit>
			</tns:ProcessComponent>
		</tns:RealizedBusinessProcess>
		<tns:RealizedBusinessProcess ID="305">
			<tns:Title>Purchase Order Processing</tns:Title>
			<tns:RealizedBusinessProcessVariant
				ID="306">
				<tns:Title>variant 1</tns:Title>
			</tns:RealizedBusinessProcessVariant>
			<tns:ProcessComponent ID="307">
				<tns:Title>Process Component 2</tns:Title>
				<tns:DeploymentUnit ID="304">
					<tns:Title>ERP Americas</tns:Title>
				</tns:DeploymentUnit>
			</tns:ProcessComponent>
		</tns:RealizedBusinessProcess>
		<tns:RealizedBusinessProcess ID="309">
			<tns:Title>Inbound Delivery</tns:Title>
			<tns:RealizedBusinessProcessVariant
				ID="310">
				<tns:Title>variant 1</tns:Title>
			</tns:RealizedBusinessProcessVariant>
			<tns:ProcessComponent ID="311">
				<tns:Title>Process Component 3</tns:Title>
				<tns:DeploymentUnit ID="304">
					<tns:Title>ERP Americas</tns:Title>
				</tns:DeploymentUnit>
			</tns:ProcessComponent>
		</tns:RealizedBusinessProcess>
		<tns:RealizedBusinessProcess ID="315">
			<tns:Title>Payment</tns:Title>
			<tns:RealizedBusinessProcessVariant
				ID="316">
				<tns:Title>variant 1</tns:Title>
			</tns:RealizedBusinessProcessVariant>
			<tns:ProcessComponent ID="317">
				<tns:Title>Process Component 3</tns:Title>
				<tns:DeploymentUnit ID="304">
					<tns:Title>ERP Americas</tns:Title>
				</tns:DeploymentUnit>
			</tns:ProcessComponent>
		</tns:RealizedBusinessProcess>
	</tns:RealizedBusinessScenario>
</tns:ScenarioFlowDiagramReferencedContent>